
"Test Automation Engineer","Test Automation Engineer","Black Box","Bengaluru, Karnataka, India","N/A","Over 100 applicants","Easy Apply","No","About the job
            

            
                
                  We have openings for Test Automation Engineer professionals at Bangalore location.Total Experience: 4+ yrsRole: Test Automation EngineerWork Location: Bangalore (Manyata Tech park)Salary: Case to case basisNotice period: up to 30 DaysMode of job: 5 Days Working from OfficeJob Description: Define and execute Test scenarios for embedded devices and systems from requirements to production release.Analyze the efficiency, stability, and scalability of Integrated systemCreate automated tests and maintain test environment for product functionality validation and reliability/stress testing.Work with Development to develop best practice for product testability.Submitting defects, problem isolation and fault finding.Work with Product Management to understand requirement definitions.Skills, Knowledge, AbilitiesProven Knowledge of formal Test methodologies.Proven experience with tools such as Jenkins, Postman, Selenium or similar test automaton tools.Good knowledge of Java, Rest API, REST Assured, TestNG and JIRA or similar tools.Experience in Web based automation testing.Will be able to work independently, should have good logical and analytical thinking.Ability to generate written Report and analysis data and trends.Network configurations/debug– switching/routing/DNS/DHCP.Configuring and installation of Windows OS/Windows Server/Linux.Good understanding of PC technologies, Video, USB, Audio, etc.Power shell and Linux scripting languages (any of the following Perl, Python, csh, bash etc).if interested, please do share your profile to vijitha.k@blackbox.com"
"Test Automation Engineer","Quality Assurance Engineer","Truelancer.com","Pune, Maharashtra, India","1 hour ago","21 applicants","Easy Apply","No","About the job
            

            
                
                  Job Title: QA EngineerExp: 7-10 yearsWork Location: Kalyani Nagar, Pune(Hybrid)Primary technology: Playwright – typescriptJob Description:Technical Skills:      Software development or QA automation experience using Behaviour Driven Development (BDD).Experience maintaining and executing manual and automated test harnesses.Experience testing REST APIs.Experience with Playwright, Jest or other best-in-class testing frameworks.Experience with TypeScript, JavaScript, Python, Cucumber, HTTP request/Assert librariesExperience with CLI tools such as GIT.
Soft Skills:      Excellent verbal and written communication in English.Excellent attention to detail.Good negotiating and influencing skills.Experience working within teams located in multiple countries.
Roles & Responsibilities:      Collaborate with development and product teams to establish test approaches.Design and implement test plans and cases.Develop and execute manual and automated tests such as API, UI, Regression, and functional and non-functional tests.Identifying defects and collaborating with the team to resolve them.Integrate tests into the CI/CD pipeline to ensure reliable and high-quality software releases.Plan and lead User Acceptance Testing with internal and external users.Prepare, set up and maintain test data alongside the ability to set up relevant tools to support test executionContribute to team initiatives to improve the overall QA process, such as identifying gaps or inefficiencies in automation workflows and manual testing processes and suggesting improvements."
"Test Automation Engineer","QA Engineer 2","Actabl","India","7 hours ago","Over 100 people clicked apply","Apply","No","About the job
            

            
                
                  DescriptionPosition Summary:As a Manual QA Engineer at Actabl, your mission is to protect Actabl’s brand by ensuring high quality product releases. You will be an integral part of our Quality Assurance team by defining and planning test strategy, creating new test suites, and running test executions with minimal guidance. You will work closely with experienced engineers, testers, product managers, who you will be learning from, and contribute to maintain the expected quality standard of our software solutions for hospitality. This role is ideal for passionate and driven individuals who are looking to build a solid foundation in software quality engineering and grow in their careers.Essential Duties      Test features to enable releasing them to customers with utmost quality standards Designing and executing Regression and Functional TestingCreate and execute test strategies with minimal day-to-day involvementFind bugs in the testing environment before the code is released to productionExecute previously defined test suites from the test case repository (XRAY)Create new test scenarios for hotfix issues and customer complaints and document them in XRAYConstantly scour the application looking for gaps in the current testing coverage. Keeping test cases up to date due to product changes/updates/enhancements. Demonstrate an understanding of work items/issues when they are discussed and know when to ask clarifying (concise and well framed) questions to further your understanding. Document precise replication steps for identified bugs and collaborate with the developers to identify the root cause
Other Duties & Responsibilities (Optional)      Strong communication skills with product owners and developers about issues and questions about work items. You are extremely reliable and get work completed in a timely manner with correct prioritizationProvide proactive and reliable communication to your supervisor regarding work related issues, absences from work, etc. Train new hires in skills specific to their tasksContinuous improvement in the existing test coverage by seeking candidates to build new test cases from items being developed in sprints
RequirementsMinimum Qualifications:      Bachelor's Degree in Engineering, Computer Science, or equivalent experience2 years of experience
Key Competencies      Experience in Agile methods, particularly ScrumExperience in documenting high quality test casesExperience using defect tracking tools Jira etc"
"Test Automation Engineer","QA Automation","Virtusa","Chennai, Tamil Nadu, India","11 hours ago","9 people clicked apply","Apply","No","About the job
            

            
                
                  Role: QA AutomationWork Mode: HybridWork timings: 2pm to 11pmLocation: Chennai & HyderabadPrimary Skills: Java, Selenium, BDD, API TestingJD: QA with minimum of 4+ years of experience       Experience in manual(SIT QA role), API testing and automation testing Experience in automation testing with Java(selenium) Familiarity with other automation tools and frameworks Strong expertise in SIT testing methodologies Good amount of work experience with Payments domain Experience in leading and mentoring a team for Functional and automation delivery
ResponsibilityDevelop and execute detailed Test plan and testcases for manual testing.Perform regression testing to identify software defectsCollaborate with developers and product managers to understand requirements and user storiesDesign and develop automated test scripts using tools like selenium and javaMaintain and enhance existing test automation frameworksExecute automated tests and analyze results to ensure software qualityConduct code reviews and ensure adherence to best practices in test automationPlan, design and execute E2E test scenariosCollaborate with crossfunctional teams to identify test requirements and ensure coverageEnsure timely identification and resolution of defectsSIT/E2E Defect management and coordinate with vendor/application teams for resolution."
"Test Automation Engineer","Senior QA Automation Engineer","HireRight","Bengaluru, Karnataka, India","22 hours ago","18 people clicked apply","Apply","No","About the job
            

            
                
                  About HireRightHireRight is the premier global background screening and workforce solutions provider. We bring clarity and confidence to vetting and hiring decisions through integrated, tailored solutions, driving a higher standard of accuracy in everything we do. Combining in-house talent, personalized services, and proprietary technology, we ensure the best candidate experience possible. PBSA accredited and based in Nashville, TN, we offer expertise from our regional centers across 200 countries and territories in The Americas, Europe, Asia, and the Middle East. Our commitment to get it right every time, everywhere, makes us the trusted partner of businesses and organizations worldwide.OverviewThe Senior Software Development Engineer in Test Automation is a position that combines skills in design; development; testing and quality assurance. Working as a senior software development engineer in test require computer science skills, communication skills and time management.The Senior Software Development Engineer in Test is a computer industry professional who can design, build and configure test automation infrastructure , produce and assess programming code to make automated testing programs, lead peer reviews, make code reviews, assess the code and make changes as needed to enhance the end-user experience.The successful candidate will bring expertise in modern testing frameworks, a strong background in software development, and a passion for quality assurance. You will collaborate with cross-functional teams to ensure our products meet high standards of reliability, performance, and scalability.Responsibilities       Design, develop, and maintain robust, scalable, and reusable automation tests.  Create, enhance, and execute automated tests for functional, regression, performance, and load testing.  Monitor and maintain automated testing.  Ensure that coding standards and best practices are being met.  Identify and troubleshoot issues with the automated tests.  Integrate automated test suites into continuous integration/continuous deployment (CI/CD) pipelines.  Improve existing testing automation or design more efficient testing.  Ensure automation coverage for new and existing features.  Collaborate with software developers, QA engineers, product owners, and other stakeholders to understand requirements and define testing strategies.  Act as a subject matter expert in application functionality  Provide technical leadership and mentor other Test Automation Engineers 
QualificationsEducation:       A Bachelor’s degree in computer engineering, computer science or related engineering field, or equivalent work  ISTQB or similar certification. 
Experience:       5+ years of experience in Development/SQA role  Minimum 3 years of experience with web service testing and web service testing tools  Experience with Selenium-like automation testing frameworks and automation testing of Web-applications.  Experience with QA processes and methodologies (automated and manual test processes, black/white box testing, load and performance testing, test case design, scripting and execution, automated test tools)  Experience with functional testing of multi-tier Web applications.  Experience working with QA tools and techniques, bug tracking systems, test design and execution.  Basic knowledge of programming languages (Java, JavaScript).  Comprehensive SQL, XML and JSON 
What Do We Offer      All resumes are held in confidence. Only candidates whose profiles closely match requirements will be contacted during this search.
HireRight, LLC is an Equal Opportunity EmployerMinorities / Females / Veterans / Disabilities HireRight does not accept unsolicited resumes through or from search firms or staffing agencies. All unsolicited resumes will be considered the property of HireRight and HireRight will not be obligated to pay a placement fee."
"Test Automation Engineer","Quality Assurance Automation Engineer","Infosys","Hyderabad, Telangana, India","18 hours ago","Over 100 applicants","Easy Apply","No","About the job
            

            
                
                  Why Infosys?Work on cutting-edge projects with global impact.Competitive salary and comprehensive benefits.Commitment to your growth through continuous learning opportunities.An inclusive culture where diversity is celebratedLocation- PAN INDIA"
"Test Automation Engineer","Senior Software Development Engineer in Test","insightsoftware","Bengaluru, Karnataka, India","Reposted 20 hours ago","Over 100 applicants","Easy Apply","No","About the job
            

            
                
                  ResponsibilitiesJob Description      Work with the Software Quality Engineering Manager and DevOps to drive quality left.Implementation and maintenance of Automated Test InfrastructureDesign/architect test automation frameworks from scratch for web, desktop, API and performance testingDevelop custom reusable test automation librariesDesign, develop and maintain automated regression suiteUse modern continuous integration and development tools and promote continuous improvement of tools and practices across the global development organization.Align automation with the speed of development. Make informed decisions on what, how, and when to automate.Support multiple testing efforts simultaneouslyThe candidate will respond to technical queries, document planning activities, coordinate with offshore team members, build work plan and Visio diagramsConducts research, recommends new tools, techniques and methodologies needed to enhance productivity and qualitySupport our test strategy on an iterative basis continuously improving quality and efficiency.Participate in daily stand-ups, sprint planning and retrospectives, and other meetings as needed.
QualificationsQualification and Experience      BS in Computer Science, Computer Engineering, or related technical discipline.Minimum of five years of automation development experience.Experience developing software and automated tests and tools in C# ( mandatory ). Java is added advantageExperience with creating an automation framework from scratchExperience in overseeing the design, development, and implementation of software testing solutions and methodologiesExperience with testing/quality assurance in a Kubernetes and/or Cloud services (AWS/Azure) environment, as well as a strong aptitude for learning new technologies.Experience with test automation tools like Cypress, Ranorex , SeleniumExperience working with various source code and CI/CD management tools (e.g., Jenkins, DevOps, Git, Bitbucket)Proficiency in designing, developing, and maintaining test cases and test suitesExperience of working in an Agile Scrum/Kanban development environmentDocker, Azure Cloud experience a plusExcellent problem solving and trouble shooting skillsStrong verbal and written communication skillsProactive with a strong sense of ownership
Additional InformationAll your information will be kept confidential according to EEO guidelines.** At this time insightsoftware is not able to offer sponsorship to candidates who are not eligible to work in the country where the position is located. **insightsoftware About Us: Hear From Our Team - InsightSoftware (wistia.com)Background checks are required for employment with insightsoftware, where permitted by country, state/province.At insightsoftware, we are committed to equal employment opportunity regardless of race, color, ethnicity, ancestry, religion, national origin, gender, sex, gender identity or expression, sexual orientation, age, citizenship, marital or parental status, disability, veteran status, or other class protected by applicable law. We are proud to be an equal opportunity workplace."
"Test Automation Engineer","Test Automation Engineer","Natus Medical Incorporated","Bengaluru, Karnataka, India","Reposted 21 hours ago","Over 100 people clicked apply","Apply","No","About the job
            

            
                
                  Welcome to Natus Sensory India We are continuing to grow our business in India and are now looking to expand our team there. Be part of this exciting journey right from the start!Natus Sensory India are a leading manufacturer of medical devices and software for a range of solutions, including eight sensory nervous systems. Our mission is to improve patient outcomes in target markets through innovative screening, diagnostic and treatment solutions. We manufacture and distribute a range of medical device products used in the diagnosis of human disorders of sensory system and neural pathways. Location:  Bangalore (remote/onsite).As a Test Automation Engineer at Natus Sensory, you will play a critical role in delivering a high-quality, modern web application that serves as Software as a Medical Device (SaMD). This highly advanced SaaS product is designed for hospitals and clinics globally, offering essential screening, diagnostic, and treatment solutions. In this role, you will ensure comprehensive test automation coverage across web applications, APIs, and backend services, driving the delivery of robust, reliable software that meets the highest standards of quality and regulatory compliance. You will collaborate with cross-functional teams to develop, execute, and maintain automated test suites, ensuring the highest quality of every product release. In this role, you will:        Have a full overview of the systems that are being tested and their expected behaviors  Work with developers to ensure that test automation is successfully implemented and executed.  Develop and maintain code that comprises the automated test.  Understand how to test performance (non-functional requirements).  Assemble and configure multi-computer setups for verification of systems and software.  Handle automated testing in a multi-platform environment.  Using your background in software test automation.  Implement and manage various types of testing, including integration, regression, end-to-end, and performance testing.  Expand your GitHub experience.  Maintain and expand the understanding of automation tools like Ranorex. 
Experience And Skills      Experience working in highly regulated industries, such as Medical Device or Pharma, with a focus on delivering high-quality devices that meet strict regulatory standards. +5 years of experience in Test Automation. Proven track record with successful execution of complex testing scenarios - preferably going across software, firmware and hardware - and across different platformsStrong C# programming skills using Ranorex for Test Automation. Bachelor's degree; or related experience and/or training; or equivalent combination of education and experience. 
 We offer        The role will start as a work-from-home remote position but will turn into a physical presence in an office role in Bangalore.  Minimal travelling: less than 5%  Collaborative and international environment with different cultures.  English company language. 
 EEO Statement Natus Sensory is an equal opportunity employer. All qualified applicants will receive consideration for employment without regard to race, color, religion, sex, national origin, veteran status, disability, sexual orientation, gender identity, or any other protected status."
"Test Automation Engineer","Software Test Engineer","LTIMindtree","Hyderabad, Telangana, India","N/A","Over 100 applicants","Easy Apply","No","About the job
            

            
                
                        Strong proficiency in Playwright for test automation along with experience in other automation tools frameworks such as Selenium.Proficiency in programming languages such as Java for writing automated test scriptsIn depth knowledge of web technologies including HTML, CSS, JavaScript, web services, RESTful APIs, Shadow DOM.Solid understanding of software testing concepts methodologies and best practicesResponsible for portfolio Automation Strategy and code reviewsExperience with CI CD tools like Jenkins GitLab CI/CD or Azure DevOps for automated test execution and integrationProficiency in version control systems such as Git for managing test scripts and codebaseStrong analytical and problem solving skills to identify defects troubleshoot issues and propose effective solutionsExcellent verbal and written communication skills for collaborating with team members and documenting test processes"
"Test Automation Engineer","QA Automation Engineer (Senior)","Infogain","Bengaluru, Karnataka, India","5 hours ago","14 people clicked apply","Apply","No","About the job
            

            
                
                  Roles & ResponsibilitiesABOUT THE COMPANYInfogain is a human-centered digital platform and software engineering company based out of Silicon Valley. We engineer business outcomes for Fortune 500 companies and digital natives in the technology, healthcare, insurance, travel, telecom, and retail & CPG industries using technologies such as cloud, microservices, automation, IoT, and artificial intelligence. We accelerate experience-led transformation in the delivery of digital platforms. Infogain is also a Microsoft (NASDAQ: MSFT) Gold Partner and Azure Expert Managed Services Provider (MSP).Infogain, an Apax Funds portfolio company, has offices in California, Washington, Texas, the UK, the UAE, and Singapore, with delivery centers in Seattle, Houston, Austin, Kraków, Noida, Gurgaon, Mumbai, Pune, and Bengaluru."
"Test Automation Engineer","Quality Automation Engineer (SDET) - Intermediate","Equifax","Trivandrum, Kerala, India","21 hours ago","10 people clicked apply","Apply","No","About the job
            

            
                
                  You are passionate about quality and how customers experience the products you test. You have the ability to create, maintain and execute test plans in order to verify requirements. As a Quality Engineer at Equifax, you will be a catalyst in both the development and the testing of high priority initiatives. You will develop and test new products to support technology operations while maintaining exemplary standards. As a collaborative member of the team, you will deliver QA services (code quality, testing services, performance engineering, development collaboration and continuous integration). You will conduct quality control tests in order to ensure full compliance with specified standards and end user requirements. You will execute tests using established plans and scripts; documents problems in an issues log and retest to ensure problems are resolved. You will create test files to thoroughly test program logic and verify system flow. You will identify, recommend and implement changes to enhance effectiveness of QA strategies.What You Will Do       You will develop Test Strategies and Plans in conjunction with App Engineering, Architecture and Prod Arch. This includes Data creation and management  You will identifying regression tests for future regression scenarios  You will identify and assure creation of re-usable, automated tests  You will influence Change Management, CI/CD, tools integration  You will modify SDLC to assure proper adherence to Engineering Handbook (including Security)  You will execute all test cases, and detect defects early  You will pretest and validate deployment plans with steps to be taken  You will execute post-deployment verification plans and record results  You will execute performance testing plans  You will establish common defect severity definitions across the company so that there is alignment between service tribes  You will complete Web accessibility testing with no open violations for customer facing web interfaces (WCAG)  You will ensure end-customer needs and associated value chain to drive processes and practices to ensure flawless customer experience.  You will raise any issues with developers and product owners  You will create test automation suite and design necessary documentation for automated processes 
What Experience You Need       BS or MS degree in Computer Science or Business or equivalent job experience required  Overall 5 years of experience in testing with minimum 3+ years in automation testing and minimum 1+ year in performance testing.  Experience in API automation testing and UI automation testing  Familiarity in working with any one of the REST clients e.g. Postman/Bruno  Familiarity in any of of the automation tools preferably Selenium with Java  Familiarity in any of the performance testing tools like JMeter / Gatling  Should be familiar with CICD and basic Infrastructure as code concepts  You have exposure to cloud  You have worked in Agile 
What Could Set You Apart       You have strong development skills and can code with Java  You have experience working in a TDD/BDD environment and can utilize technologies such as JUnit, Rest Assured, Appium, Jbehave/Cucumber frameworks, APIs (REST/SOAP)  You understand Continuous Delivery concepts and can use tools including Jenkins/Bamboo and vulnerability tools such as Sonar, Checkmarx/Fortify, etc."
